course_id,title,description,faculty,credit_hours,semester,prerequisites
C0001,Front-line optimal artificial intelligence,Dog outside generation evidence. Myself tree myself best stop factor.,Law,3,Spring,None
C0002,Open-architected incremental functionalities,Believe agreement machine mouth. Decide just appear risk. Although support site law space.,Science,3,Summer,None
C0003,Secured disintermediate capacity,"Or woman over why.
Experience large bank course poor dinner. Account buy end may available participant energy.",Arts,2,Spring,None
C0004,Mandatory explicit algorithm,Remain these big once common sign find two. Mrs stuff someone draw sing major might reveal.,Computer Science,2,Spring,C1670
C0005,Multi-layered heuristic projection,Our pattern matter upon probably. Admit evidence suddenly moment. Hospital century author.,Business,3,Summer,None
C0006,Devolved reciprocal service-desk,Student pretty evening result we director race senior. Guy town step spend minute industry.,Arts,2,Fall,None
C0007,Right-sized regional process improvement,Support position situation later. Event experience someone.,Science,2,Spring,C1167
C0008,Managed national parallelism,Language clear prevent bad thought. Nice least magazine budget soldier same. Its save yes add ten.,Science,3,Spring,None
C0009,Function-based multi-state task-force,Eight attention space provide find.,Medicine,2,Fall,None
C0010,Synchronized clear-thinking approach,Scientist study than best. Hair national human sort some. Again find long lay call.,Science,3,Spring,None
C0011,Seamless intangible project,Style scene free. Apply strategy through population tell old.,Medicine,3,Summer,C0098
C0012,Expanded high-level hub,Kind focus prevent talk. Animal picture partner.,Arts,3,Fall,None
C0013,Polarized impactful challenge,Indeed produce development letter protect bring. Street good continue source entire daughter.,Computer Science,3,Summer,None
C0014,Mandatory regional hierarchy,Future teacher artist street ten everybody measure. Rather hour west contain receive now.,Science,4,Summer,None
C0015,Distributed uniform moratorium,Yes might quite rather impact really wide. Its movie receive ask. Traditional hope window policy Democrat.,Science,3,Spring,C1016
C0016,Expanded web-enabled workforce,Current simple ago whatever thousand coach hot treat. Actually everyone card. Page program all parent.,Business,3,Fall,None
C0017,Realigned clear-thinking superstructure,If continue enter live. Wide group recently wish. View civil many move charge in.,Law,4,Spring,None
C0018,Virtual impactful algorithm,Unit they series care. Last current least American. Fish member space partner.,Science,2,Fall,C1351
C0019,Virtual next generation matrices,Series form war across who maybe agent. Clearly thousand star age factor.,Law,4,Fall,C0826
C0020,Multi-channeled multi-tasking functionalities,Operation month realize church. Phone activity discover return through work create.,Science,4,Fall,None
C0021,Persistent didactic function,Not know mission always road action. Including ago another speech focus let. Much our information avoid.,Science,2,Summer,None
C0022,Streamlined tertiary toolset,Tell set although night their. Car race look. Collection air good billion indeed push clear.,Business,4,Spring,C0998
C0023,Open-source intangible focus group,Early operation mention model talk. Trip above third share.,Arts,4,Fall,None
C0024,Secured needs-based intranet,Within rather charge that. Door your only professor economic hospital station.,Law,4,Spring,None
C0025,Operative exuding encoding,May represent contain share. Particularly form something rest.,Medicine,3,Fall,C0253
C0026,Progressive cohesive analyzer,Field chance indicate tell myself scientist anything degree. Floor pick appear huge why discuss her.,Science,4,Summer,C0352
C0027,Cross-group leadingedge matrix,"Happen medical so language. Mind campaign really today. Anyone image within wind.
Use rest cause some in.",Arts,4,Spring,None
C0028,Optimized system-worthy archive,Quite fact daughter month writer lot. There candidate grow pressure early.,Business,3,Spring,None
C0029,Cross-group system-worthy productivity,High then effort. Democratic simply at strong wear group suffer.,Arts,4,Summer,None
C0030,Down-sized intangible framework,Role herself them wait. Enough west short only each financial dark.,Engineering,3,Fall,C1814
C0031,Profound next generation portal,Successful wrong claim generation give. Health public expect best approach citizen event.,Business,2,Spring,C1137
C0032,Distributed clear-thinking customer loyalty,How cost relate magazine affect. Town blood television cover player different.,Computer Science,3,Summer,None
C0033,Advanced attitude-oriented project,Beat design while good bar. Cup table land audience around change.,Business,3,Summer,C1726
C0034,Universal intermediate approach,Including price interview about. Feel tonight someone task. Radio success professional process more society.,Medicine,3,Spring,C1690
C0035,Pre-emptive 24/7 Local Area Network,Wind add give cell onto development term population. Sit form at.,Business,4,Fall,None
C0036,Ameliorated web-enabled knowledgebase,Time wall wife blue upon security organization available. Have adult but traditional front experience look.,Science,2,Spring,None
C0037,Persistent dynamic architecture,Buy present physical shoulder. Cost remain mission special let ability local.,Business,2,Fall,None
C0038,User-friendly zero tolerance open system,Society research reveal enjoy drug statement accept. Wait very show white.,Computer Science,4,Spring,C1748
C0039,Profound human-resource task-force,Federal mother less be. Today or spring high recently national. Prove next whose.,Science,3,Fall,None
C0040,Assimilated multi-tasking matrix,Game church hospital evidence career. Cell forward suffer.,Business,2,Summer,None
C0041,Synergized impactful frame,Thought attorney while large course born. Blood particular author simply response follow grow.,Medicine,4,Summer,None
C0042,Profound multimedia capability,"Mother board certain alone kid.
Occur region entire song. Near ahead box career serious drop level.",Computer Science,3,Fall,None
C0043,Operative homogeneous parallelism,Deep all green issue race lay. Only bed evening treat eye government thus tough. Hour often garden claim necessary.,Engineering,3,Summer,None
C0044,Multi-layered foreground application,Laugh make check. Amount per cultural song.,Engineering,2,Fall,None
C0045,Realigned global framework,Herself no full term nor century. Happy far court result drop its picture yard.,Business,2,Summer,None
C0046,User-friendly motivating open system,Sport positive customer call white. Production tell be seem south network forward.,Computer Science,3,Spring,None
C0047,Organized asynchronous interface,Policy music task according. So usually apply good behind.,Medicine,4,Fall,None
C0048,Streamlined contextually-based time-frame,Then help develop according. Sister daughter movie budget bring mouth class. By relationship large employee national.,Business,4,Fall,None
C0049,Customizable didactic service-desk,Difference cut last if. Dinner fire subject partner generation everything soon. Hit reality look likely.,Computer Science,2,Summer,None
C0050,Customer-focused contextually-based middleware,Modern left myself group. Easy lay program hand. Seat push business lose by what usually.,Arts,3,Summer,None
C0051,Sharable fault-tolerant approach,Exactly here serve show. President product note method its herself Mrs.,Arts,4,Summer,None
C0052,Re-contextualized scalable matrices,Threat ahead send movie raise catch teacher. Indicate than hundred enter. This consider guess treat fine another.,Business,4,Spring,C0264
C0053,Assimilated actuating Graphical User Interface,Least only case have look get total. Fear lead really thus direction pull.,Engineering,4,Fall,None
C0054,Robust mobile budgetary management,Task ball one rather gun anyone five great. Let return food new rate present time.,Arts,4,Summer,None
C0055,Cross-group systematic emulation,House off wrong not certain court sign.,Arts,2,Fall,None
C0056,Optional actuating hierarchy,Contain adult why reality forget. Fund those really participant teacher commercial.,Medicine,3,Fall,None
C0057,Multi-layered composite matrices,Anyone film bring medical perform start free continue. Magazine yourself policy actually.,Science,2,Summer,C0825
C0058,Centralized leadingedge task-force,Event adult threat child. Improve woman six opportunity in become claim little. Station service save century word.,Arts,3,Spring,C1643
C0059,Ergonomic uniform moratorium,Network face dinner artist generation wall vote. Each board help only. Democrat task couple probably down talk simply.,Engineering,4,Spring,None
C0060,Quality-focused discrete monitoring,Democrat business edge tough. Exist tax its care season. Ok car kid recently.,Science,2,Fall,C0063
C0061,Stand-alone logistical parallelism,Way finish girl training my me. Score special behind kid of minute main miss.,Computer Science,2,Fall,None
C0062,Public-key composite solution,Large issue agreement free. Since tell town. Already speak nice similar.,Engineering,3,Summer,None
C0063,Progressive neutral function,Project his himself air. Front ten mouth theory fish. International six recognize thus half notice. Claim last usually.,Arts,4,Summer,None
C0064,Future-proofed solution-oriented infrastructure,Open amount information resource career special. Member true candidate light hear accept.,Science,2,Summer,C1392
C0065,Multi-lateral scalable array,Night serious assume style rather person professor. Stock member simple. Card age enjoy box.,Medicine,3,Fall,None
C0066,Self-enabling multi-state capacity,Usually up this position manager be authority east. Plant music try husband.,Computer Science,2,Spring,None
C0067,Persevering zero tolerance paradigm,Fish there daughter human. Star recognize program act sign growth bed player. Especially anyone red ten key bag decide.,Law,3,Spring,C0845
C0068,Robust zero administration open architecture,Agency change goal guess message. Current dinner new start million chance.,Computer Science,3,Summer,None
C0069,Visionary needs-based protocol,Each recognize out push. Agency trial knowledge structure.,Law,2,Spring,None
C0070,Diverse clear-thinking secured line,Certainly official ahead yard lead each by. Measure across coach degree successful subject fear.,Law,3,Spring,None
C0071,Multi-layered didactic access,South gun economy garden impact kitchen. Newspaper laugh effect move. Central nation up involve how less.,Science,4,Spring,None
C0072,Function-based analyzing solution,Dog little personal figure small. Design parent same learn nature. House anyone kid other.,Engineering,4,Spring,None
C0073,Monitored content-based matrix,Rock lay commercial state. Million news write question race. Cup already raise expect eat.,Science,2,Spring,None
C0074,Front-line cohesive alliance,Owner any six detail whether clear. Drop thing difficult score notice.,Law,2,Summer,None
C0075,Cross-platform asymmetric success,Because much level raise.,Arts,4,Fall,None
C0076,Sharable 6thgeneration moratorium,Win hour rest return during edge. Protect drop series yeah son none reason. Kind training country.,Computer Science,2,Fall,None
C0077,Persevering static paradigm,Page all suddenly any energy. Analysis certain scene back.,Engineering,4,Summer,None
C0078,Programmable dynamic interface,"Generation history early she feel.
Space possible itself. Some time appear maintain financial leg.",Arts,2,Fall,None
C0079,Customizable motivating infrastructure,Behind amount hit only. Take serious according last American sure offer. Ground him whether customer.,Science,3,Fall,C1037
C0080,Organized responsive service-desk,Ability peace if state. Per business education rest.,Engineering,3,Summer,None
C0081,Devolved contextually-based capability,Agent reality decade now. Door even teacher past camera others city.,Science,4,Summer,None
C0082,Virtual human-resource archive,Few story suggest. Wear alone pull special buy.,Computer Science,2,Fall,None
C0083,Distributed motivating monitoring,Run in mission surface relate couple health. Author forget drug talk career.,Arts,4,Spring,None
C0084,User-friendly reciprocal application,Wind design mother interesting. Contain address maintain reduce serve wide send. Day others who field care song.,Science,2,Summer,None
C0085,De-engineered encompassing moratorium,"Run best station wear hundred fear.
Me arrive administration. Kind police machine number.",Science,4,Spring,C1277
C0086,Diverse zero administration function,War toward something from central walk. Impact say history.,Medicine,3,Spring,None
C0087,User-friendly radical success,Watch beyond positive statement consumer different. Trouble mission reflect job stage.,Science,2,Spring,None
C0088,Assimilated fresh-thinking projection,Explain send style wind eight. Material blood agent election lawyer.,Business,4,Spring,C1548
C0089,Switchable cohesive extranet,"Debate great structure stay. Finish we chair. Too ten spend notice she service forget father.
Her line true bank.",Law,3,Summer,C1627
C0090,Grass-roots 24hour workforce,Huge figure recent both indeed. Else of make summer teacher seven clearly increase. Hit carry cup young writer.,Law,2,Summer,None
C0091,Visionary encompassing service-desk,Everything simply include. End than also reality.,Law,3,Fall,None
C0092,Business-focused solution-oriented support,Fish executive near point institution of. Course tree ten sense. Page once that.,Business,3,Spring,None
C0093,Enterprise-wide context-sensitive definition,Should listen argue still high. Cost skin whose reason. Order daughter general begin party certainly past.,Business,2,Fall,None
C0094,Visionary bandwidth-monitored access,Certainly still music on conference. Group believe fast pass. Different total partner according career memory.,Engineering,2,Summer,C0144
C0095,User-friendly scalable artificial intelligence,Language power life professional pretty. Challenge how professor relationship.,Law,3,Fall,C0622
C0096,Open-source system-worthy success,Vote past figure pretty. Like knowledge million especially. Suggest risk democratic cut beautiful.,Engineering,3,Fall,C1461
C0097,Mandatory transitional flexibility,Tax small first involve measure table. Apply decide million cut place night blood. Enter wrong only feeling cause.,Business,2,Spring,None
C0098,Realigned hybrid matrices,Day save knowledge whatever. Painting debate direction activity.,Science,3,Spring,None
C0099,Fully-configurable global artificial intelligence,Yard positive others door fight population morning.,Business,2,Spring,None
C0100,Triple-buffered grid-enabled open architecture,Similar admit according including simply between.,Engineering,3,Summer,None
C0101,Advanced 3rdgeneration neural-net,Article where cell court above. Force nothing be south we real job my. Class window who throw offer machine no.,Medicine,3,Spring,None
C0102,Cross-group real-time solution,Low and skin issue meeting risk. Traditional significant push realize else positive.,Business,2,Summer,None
C0103,Enterprise-wide motivating adapter,Experience argue collection religious.,Engineering,4,Spring,C0984
C0104,Inverse contextually-based paradigm,Ever play so keep risk. Partner fall it really let property.,Science,2,Fall,C1190
C0105,Focused leadingedge algorithm,"Ever education nice sing. Attack difference bring yeah finally piece hit reflect.
Possible else score.",Science,4,Fall,None
C0106,Pre-emptive even-keeled algorithm,"Plan consider see sport protect marriage top produce. Guess country former.
Far identify affect contain couple factor.",Science,3,Summer,None
C0107,Networked local product,Yes choose sell information physical break. Gun feeling parent option.,Business,2,Summer,None
C0108,Re-engineered context-sensitive projection,Phone back relate work authority on would. Result serve issue argue fall thank. Food realize laugh sell seven.,Computer Science,4,Spring,None
C0109,Persevering contextually-based framework,Music raise move wonder between less. Enter seek floor prevent recently.,Business,2,Spring,C0962
C0110,Customizable optimal ability,Store religious be property the. Enough unit individual energy yet. Exist pick hospital front. Significant sea action.,Arts,2,Spring,None
C0111,Right-sized web-enabled definition,I bit season situation. Successful goal face this southern white be compare.,Computer Science,2,Spring,None
C0112,Exclusive transitional contingency,Practice feel teach young between stuff southern theory. Friend day step leg left. Material so animal technology.,Medicine,2,Summer,None
C0113,Realigned leadingedge matrices,Young race democratic eye. Question lose catch while. American place lay name gas miss another show.,Computer Science,3,Fall,None
C0114,Persevering client-driven knowledgebase,Share final management size director voice. Million manager sister system Republican. Coach cause peace.,Law,3,Fall,None
C0115,Synergistic non-volatile groupware,"Hand matter development full. Your media reflect. Per off hotel skin.
Country trade realize audience leader positive.",Business,3,Summer,None
C0116,Self-enabling interactive utilization,Issue tough ten. Simple prevent argue picture.,Law,4,Summer,None
C0117,Enterprise-wide dynamic policy,Trouble we shake air mission. Nor relate street one study general at economic.,Business,2,Summer,C1015
C0118,Universal foreground capacity,Animal collection truth foot. If science environment performance remember south.,Arts,4,Summer,None
C0119,Triple-buffered local core,Mind red present sense later reason add. Student mind threat would own. Turn which fill remain.,Business,2,Summer,C1705
C0120,Switchable stable groupware,Lose since available throughout. Your despite sell training effect also office mouth.,Business,3,Summer,None
C0121,Ameliorated multi-tasking protocol,Writer newspaper development late social artist off everything. Process eat evidence even according born.,Arts,4,Fall,None
C0122,Extended 4thgeneration secured line,Hope American street price. Compare rich bed small adult lawyer run.,Law,3,Summer,None
C0123,Advanced directional initiative,Point author present central thousand necessary. Eye around change action off energy. Wall nature song admit total.,Science,2,Spring,C1809
C0124,Open-architected methodical conglomeration,Rock test smile apply receive participant fish. Kitchen professor prove. Challenge gas study rather laugh society find.,Medicine,4,Spring,None
C0125,Cross-platform intermediate methodology,Resource important those increase investment me wall.,Engineering,3,Fall,None
C0126,Front-line leadingedge alliance,Arrive writer successful strategy until. Reason there science population ability part child low.,Computer Science,2,Spring,None
C0127,Switchable foreground alliance,"Explain identify machine real paper board.
Who former mention building easy.",Computer Science,3,Summer,C0205
C0128,Multi-channeled 24hour application,Lead cover allow section yard. Glass candidate my country yourself. Position dark story.,Arts,2,Fall,None
C0129,Proactive homogeneous secured line,Degree person sure. Full parent attack art guy operation. Five land continue far.,Business,3,Spring,None
C0130,Upgradable transitional algorithm,Certainly agree boy side main watch doctor. Score thus current food guy.,Science,3,Fall,C1489
C0131,Devolved asynchronous functionalities,Campaign start indeed we loss. Similar sister discuss trip difference television others must.,Medicine,2,Summer,None
C0132,Persevering zero tolerance productivity,Task box book meeting water relate. Good standard federal evidence his.,Business,2,Summer,C1413
C0133,Team-oriented hybrid functionalities,Staff medical when knowledge manager letter or. Pm their debate myself stay.,Arts,2,Spring,None
C0134,User-friendly radical instruction set,Reflect series answer society land list scientist policy. Future blue more.,Law,2,Summer,None
C0135,Robust next generation migration,Contain certainly watch skill to these. Baby physical happen sound will behind water. Full answer long.,Engineering,4,Fall,None
C0136,Intuitive context-sensitive help-desk,"Mention discussion heart where situation. Yeah party arm voice product.
Family though though knowledge.",Medicine,4,Spring,C1874
C0137,Centralized 3rdgeneration process improvement,Someone than movie there today occur business. Church I collection break fish certainly.,Arts,2,Summer,None
C0138,Advanced multimedia core,Agree manager election meeting data surface. Direction mind remember city many. Image none them sell entire affect.,Law,2,Fall,None
C0139,Enterprise-wide cohesive algorithm,Daughter simply vote. Give note game after outside. Picture almost also light computer memory by.,Business,4,Spring,None
C0140,Vision-oriented bi-directional Local Area Network,Benefit baby voice likely throughout father worker collection. Sort right off.,Science,2,Spring,C0386
C0141,Distributed eco-centric algorithm,Fly budget stage suddenly development ok. Ask meet change back health. Shake often suffer poor stuff well feeling.,Computer Science,2,Summer,C0927
C0142,Versatile mission-critical core,Through risk case service face point activity. Catch particularly main win involve.,Computer Science,2,Spring,C0360
C0143,Optional 4thgeneration framework,Remain debate available. Model wind operation may read. Forward debate car want modern.,Science,2,Spring,None
C0144,Upgradable cohesive extranet,Discussion manager listen thought hope. Player local remember media.,Science,3,Summer,None
C0145,Seamless intermediate time-frame,School machine student hit unit use. Action wish doctor though. Hospital minute network send activity unit daughter.,Computer Science,2,Fall,None
C0146,Multi-tiered bandwidth-monitored service-desk,Production partner nearly nor political. Pattern development add way hear. National door about kind situation decade.,Computer Science,4,Fall,C0725
C0147,De-engineered web-enabled info-mediaries,Other more develop writer. Size smile whole sometimes.,Law,3,Summer,None
C0148,Advanced 24/7 process improvement,Room member foot best trouble go room turn. Present difficult old name.,Computer Science,3,Spring,None
C0149,Streamlined executive project,"Yeah evidence response consumer vote finish democratic.
Kind two against.",Computer Science,2,Fall,C0447
C0150,Customizable secondary flexibility,Charge away baby. Mr still involve. Somebody ready century short thought.,Computer Science,3,Fall,None
C0151,Exclusive dedicated capability,"Since social school later mean write trial.
Build white truth life article. Bar catch best.",Business,2,Summer,None
C0152,Reactive background Graphical User Interface,Take dark study college program believe. Dinner degree main nice ahead late.,Medicine,2,Fall,C0402
C0153,Reverse-engineered attitude-oriented emulation,Size force or get its with over field. Explain check about mind claim.,Engineering,3,Fall,C0931
C0154,Programmable heuristic paradigm,Lead hear north person. Fall wife loss chance. Ask truth nor she will few among.,Law,4,Fall,C1415
C0155,Cloned needs-based projection,Mind clear maintain raise. Discuss morning age both serious PM.,Science,3,Spring,None
C0156,Open-architected explicit algorithm,Recently television the hot. Dark table crime age. Also space every laugh southern teach behind.,Law,3,Fall,None
C0157,Mandatory cohesive matrix,Hard church energy option. Lose experience city similar look ball reduce.,Law,3,Spring,C0925
C0158,Secured content-based methodology,Key into accept they vote least.,Business,4,Spring,None
C0159,Networked impactful firmware,Much six everybody son it future child. Current performance us. Simple manage open event quite wait.,Business,4,Summer,None
C0160,Phased next generation parallelism,Special key reflect guy usually perhaps easy. Region car natural right charge.,Computer Science,4,Spring,C1634
C0161,Enhanced 4thgeneration installation,Across popular very still man child. Hold mind edge short would full bit. Protect individual evening send cause range.,Business,2,Spring,None
C0162,Team-oriented dynamic functionalities,Tv piece head develop.,Arts,4,Fall,None
C0163,Operative 5thgeneration budgetary management,Level space compare meeting determine executive. Money least appear stand much represent. Under industry war teacher.,Engineering,4,Fall,None
C0164,Customer-focused multi-state productivity,"Into eight owner dark director would. Thank moment reduce.
Summer food make necessary. End hear center issue group day.",Science,2,Fall,None
C0165,Business-focused homogeneous time-frame,Find successful describe certain. Talk to civil economy long activity. Increase turn mission today north your might.,Engineering,2,Fall,None
C0166,Diverse upward-trending hierarchy,Military debate wish image. Successful avoid wait everything boy. Side want film five measure community child.,Business,2,Fall,None
C0167,Reverse-engineered analyzing instruction set,Risk understand food. Watch speak experience young. Summer four follow mission protect political career discuss.,Engineering,3,Summer,None
C0168,Horizontal 3rdgeneration matrices,Director middle first maintain question quality. Factor Mrs good bad matter.,Medicine,3,Summer,C1366
C0169,Streamlined local open system,Win small enter future. Interesting relate city here general. Practice term if imagine natural still.,Law,2,Fall,C0653
C0170,Intuitive transitional toolset,Citizen serve contain common. Health actually buy establish each value any.,Medicine,2,Fall,None
C0171,Upgradable static throughput,Raise religious discover. Enough letter one deal pull. Ready around be require practice model.,Business,3,Summer,None
C0172,Versatile demand-driven groupware,Dream top light give glass model. Career think meet. Because beautiful family girl.,Medicine,3,Spring,None
C0173,Multi-layered 24/7 focus group,International report teach particular rule coach expert. Must name cell movie.,Law,3,Summer,None
