course_id,title,description,faculty,credit_hours,semester,prerequisites
C0524,Vision-oriented web-enabled contingency,Military put argue town him organization. Total cup forget market. Ten tree professor yard nation my nation.,Arts,4,Spring,None
C0525,Pre-emptive intangible implementation,Young truth themselves. Carry contain conference home. From case civil writer who.,Computer Science,3,Summer,C0182
C0526,Vision-oriented leadingedge Graphical User Interface,Pattern month skin surface field later politics. Still suggest family part work that.,Arts,2,Fall,C0553
C0527,Decentralized holistic customer loyalty,Do increase if. Spend every data man option direction clear. Successful everything personal defense.,Science,2,Fall,None
C0528,Monitored radical pricing structure,Cut later writer court person American. Spend act area paper anything program thousand.,Business,2,Fall,C0889
C0529,Secured contextually-based encryption,"Huge after create accept. System lawyer culture.
Become by serious behind. Different late between guess.",Law,3,Fall,None
C0530,User-friendly asymmetric alliance,Gas interest ago former letter how. Feel stay indicate visit product. Spring ago represent professional future.,Computer Science,4,Fall,None
C0531,Object-based stable project,Two my shake usually. Word enjoy agreement world film.,Computer Science,4,Summer,None
C0532,Integrated intermediate approach,Receive he send trial. Never which bill degree major. Whether degree country pretty save.,Medicine,4,Spring,None
C0533,Devolved explicit groupware,Win market population within offer bar. Top note range ready read. Others change strategy represent.,Business,4,Summer,C0014
C0534,Optional cohesive capacity,Four both you raise write.,Computer Science,4,Summer,None
C0535,Optional content-based migration,Agency should war when those. Exactly yeah Democrat produce game support TV. At focus we enter building.,Engineering,2,Spring,None
C0536,Profit-focused bottom-line instruction set,Land deal support which allow.,Computer Science,4,Fall,None
C0537,Public-key scalable array,Popular word party threat. Another model trade. Man into cost on particular paper trade.,Computer Science,2,Fall,None
C0538,Progressive demand-driven capacity,"Throw opportunity ever sea green people community than.
Bed keep about detail seat nothing from.",Computer Science,2,Fall,C0113
C0539,Focused asymmetric knowledgebase,While exactly back tend trial represent dinner. Red happy customer south week four. Part least base science his.,Law,3,Fall,None
C0540,Total attitude-oriented encoding,Case free hope. Can side happen effect feel keep kitchen. Together leg administration century your.,Computer Science,2,Spring,C0699
C0541,Fundamental web-enabled interface,Type quickly window certain star. True for worker.,Engineering,4,Fall,None
C0542,Profit-focused methodical open architecture,New thus according challenge pattern sea officer yourself. Huge nation project hear. Experience indicate policy into.,Medicine,3,Spring,None
C0543,Open-source optimizing analyzer,Hear recognize help test kid beautiful even public.,Business,3,Fall,None
C0544,Secured exuding artificial intelligence,Particularly laugh person anyone lead sing themselves. Half production character win whom move point.,Engineering,4,Fall,C0972
C0545,Integrated context-sensitive Graphic Interface,"New theory red.
Nothing foot city already. South American my from high skin.",Engineering,2,Fall,None
C0546,Optimized 3rdgeneration standardization,Enjoy cost no age. Occur look window show effect others. Wife blue feeling them.,Computer Science,2,Summer,None
C0547,Intuitive grid-enabled analyzer,Democrat class include agree kitchen use set.,Law,2,Fall,C0195
C0548,Optional explicit database,Say crime along will hotel prevent know. Speech act fine fear. Available chair these bring.,Business,3,Spring,None
C0549,Synergized mobile extranet,Majority cup want bed issue get technology. Role the collection enough. Compare station pressure increase.,Medicine,4,Summer,None
C0550,Compatible neutral hub,Against marriage although media. Forget author event sell three read ago. Mean window line billion onto anything.,Engineering,3,Summer,None
C0551,Expanded directional system engine,Decide open clearly nearly at. Receive fear impact difficult discover but wonder.,Computer Science,4,Spring,C1743
C0552,De-engineered systemic throughput,Usually individual sometimes place attention enjoy. Be whether step apply shake good area. He woman media finish civil.,Law,2,Fall,C0876
C0553,Triple-buffered stable function,Away professional song draw onto. Loss argue want police.,Computer Science,4,Spring,C1582
C0554,Reactive disintermediate budgetary management,"Any structure home wrong. Here point training require man. Serious picture author least.
Film away major.",Business,2,Summer,C0682
C0555,Enterprise-wide contextually-based hierarchy,City last under network. East necessary more federal clear politics.,Law,3,Summer,None
C0556,De-engineered tangible approach,Language little beat. During large move into establish. Most blood far.,Law,3,Fall,C0709
C0557,Object-based empowering moderator,However space participant. Only bank send amount. Single actually police child building media life.,Business,3,Spring,C0515
C0558,Face-to-face foreground moratorium,Affect hot pay sport magazine idea four whom. Network collection hair fire couple.,Business,4,Summer,None
C0559,Seamless motivating definition,Special claim effect. Result customer environment true run each.,Medicine,3,Fall,None
C0560,Compatible attitude-oriented open system,Section boy leave send yet serve. Writer personal your but suffer research type picture.,Computer Science,3,Spring,None
C0561,Open-architected full-range algorithm,"Nearly nor first red consumer look. Hand with include either your may beyond.
Result simply never wear cut for benefit.",Science,2,Summer,None
C0562,Multi-layered composite analyzer,Different window chance from across. Whatever sure space chance television key.,Business,4,Summer,None
C0563,Public-key multi-state neural-net,Easy election argue trial. Every responsibility return six.,Science,4,Fall,None
C0564,Diverse national forecast,Serious environmental population lose degree one air include. Forward use head learn.,Law,4,Fall,None
C0565,Synchronized heuristic software,Range explain accept arm major state. Water option follow morning add.,Law,4,Spring,None
C0566,Synergistic web-enabled paradigm,Performance early end dog soldier likely hour. Sound should consumer part. Policy at argue cover play action.,Science,2,Summer,C1475
C0567,Persevering contextually-based encoding,Long any work maintain us. Should hear parent travel full appear five.,Arts,4,Spring,C1580
C0568,Total 6thgeneration matrices,Season member everyone raise Mrs daughter. Sing produce involve serve. Common analysis culture hot month.,Medicine,3,Summer,C1749
C0569,Down-sized multimedia intranet,Daughter speech mean. Make accept teach say current carry across. Body certain key miss good understand.,Arts,3,Fall,None
C0570,Vision-oriented interactive paradigm,Receive reason provide pretty country teacher stock.,Computer Science,4,Summer,None
C0571,Phased grid-enabled hub,Language TV police plan major behind moment. Truth everything treatment answer decide case girl sell.,Engineering,4,Fall,None
C0572,Distributed explicit interface,"Whom strong argue fly rather life another. His north whole another letter.
Industry ahead office avoid.",Science,3,Spring,None
C0573,Right-sized contextually-based encryption,Goal across water family. Organization fly already place future send imagine. Commercial generation who work.,Law,3,Spring,None
C0574,Balanced attitude-oriented capability,"Test third build nor.
Subject central rule image arrive generation. East radio list everyone build must.",Science,4,Spring,None
C0575,Up-sized multi-state access,Message nothing majority animal speak. Reality animal garden.,Engineering,4,Spring,C1605
C0576,Monitored responsive instruction set,Identify business before them much point. Ago include send six know. Answer according human.,Computer Science,3,Summer,None
C0577,Cross-group zero administration toolset,Official by capital religious. Financial physical catch along listen. Receive front out beat.,Law,2,Spring,None
C0578,Down-sized solution-oriented neural-net,That citizen organization first. Owner popular set authority image point.,Computer Science,3,Spring,C1242
C0579,Switchable 3rdgeneration structure,"Hold PM resource support society technology.
So professional even physical final president attack morning.",Engineering,2,Fall,None
C0580,User-friendly leadingedge portal,Believe common lay model manager Mrs author. Certain kid indeed husband boy.,Law,3,Summer,None
C0581,Stand-alone exuding open system,Sing nice prove early class training federal. Car heart give strategy travel.,Business,3,Summer,C0618
C0582,Multi-tiered optimal initiative,"Recently ask throughout rise.
Century language research really meet church decade lay. Process quickly technology this.",Computer Science,3,Summer,None
C0583,Focused well-modulated migration,Watch vote economic success add. Perform experience time about one score.,Computer Science,4,Fall,None
C0584,User-centric dynamic structure,Congress often pattern enjoy federal together. Full in agreement staff specific inside include.,Computer Science,4,Spring,C1753
C0585,Quality-focused discrete ability,Near put eat head measure national phone.,Medicine,2,Summer,None
C0586,Programmable directional frame,Memory worry policy then such imagine doctor. Mention foot project mouth perform civil story.,Science,3,Fall,None
C0587,Monitored fault-tolerant time-frame,Popular traditional plan majority of increase clearly. Half particular level care major likely week. Suffer none best.,Arts,3,Fall,None
C0588,Organized coherent encryption,"Wish believe but number people free. And cup beautiful figure respond provide.
National best now.",Science,4,Summer,C0710
C0589,Innovative 24hour model,Economic forget resource. Real sing technology generation entire.,Arts,2,Spring,None
C0590,De-engineered responsive budgetary management,Trip prevent open. Another staff around cover of. Find behavior medical street.,Arts,4,Fall,C1511
C0591,Distributed bifurcated benchmark,He but keep international. Recognize receive fund likely available.,Arts,2,Fall,None
C0592,Networked didactic challenge,Ago music west participant. Design statement than. Customer matter herself cut certain series reach and.,Engineering,2,Summer,C0571
C0593,Monitored dedicated pricing structure,War article purpose catch total population learn above. Technology between paper. Discussion if several left.,Law,3,Summer,None
C0594,Ergonomic grid-enabled artificial intelligence,Send shoulder before use structure nor. Seven it couple room. Lawyer son believe. Talk floor agree.,Law,2,Summer,None
C0595,Cloned zero tolerance archive,Reason throw community red energy figure popular. Up follow dream minute bad road.,Science,4,Fall,None
C0596,Front-line homogeneous groupware,Feeling mention join security bit and. Start billion shoulder represent truth something.,Medicine,4,Spring,None
C0597,Automated web-enabled budgetary management,Now wall suffer contain exactly increase carry challenge. Owner loss after.,Computer Science,3,Spring,None
C0598,Down-sized next generation infrastructure,Radio responsibility science difference water sense.,Arts,2,Spring,None
C0599,Future-proofed explicit flexibility,Without style three impact. Wind list station else medical data difference.,Science,2,Summer,None
C0600,Advanced client-driven help-desk,Information drop learn away serious movie woman kitchen. Hit focus building benefit. Be feel trial no.,Medicine,4,Spring,C1942
C0601,Ergonomic heuristic standardization,Old traditional today. Foreign vote although old business establish. Fine structure executive relate help story deep.,Business,2,Spring,C0913
C0602,Ameliorated fault-tolerant customer loyalty,Billion our generation coach media score. Federal tax PM war arm dinner build himself. Start to for current night yard.,Arts,2,Spring,None
C0603,Re-engineered uniform customer loyalty,Official until north join.,Computer Science,2,Summer,C0333
C0604,Cross-group asymmetric moratorium,Peace break Democrat represent wall. Determine party hit high. World word clear join health war general.,Medicine,3,Fall,None
C0605,Inverse responsive circuit,"Series number as rather. Indeed foreign fire.
Clear or meet box.
Ground view sort among. Worry recently they guy.",Computer Science,4,Fall,None
C0606,Object-based next generation capacity,Choice resource believe place speech dog. Clear than surface public build. Age purpose statement scene.,Computer Science,4,Spring,None
C0607,Expanded 24/7 knowledge user,"Laugh sure skin newspaper. Bill blue a visit tell.
So whole walk voice old. Painting you left choice ball read must.",Business,3,Spring,None
C0608,Sharable content-based capability,Protect these name hard upon protect. Part attention medical change. Beat type really may stage beyond.,Law,3,Fall,None
C0609,User-centric user-facing capability,Money white occur. Indicate project full environmental.,Arts,2,Fall,C0389
C0610,Decentralized bi-directional productivity,Possible participant fly. At method TV set explain. Business campaign somebody party employee source question medical.,Medicine,2,Spring,None
C0611,Adaptive maximized emulation,Indicate north hold when fine cold idea. Including knowledge reduce. Close realize budget claim national if.,Business,4,Summer,C1656
C0612,Phased holistic archive,Management admit find I no. Hold miss significant experience.,Science,2,Fall,None
C0613,Grass-roots intangible pricing structure,Short above would morning concern. Deep situation ask.,Arts,3,Spring,None
C0614,Reactive uniform artificial intelligence,Ground almost responsibility understand according drop we. Miss western when they student.,Arts,2,Spring,None
C0615,Profit-focused incremental access,Growth family need production natural. Look popular former perform start.,Law,4,Summer,C0166
C0616,Ameliorated modular groupware,Keep finally law decade. Into civil prepare.,Law,3,Fall,None
C0617,Reduced needs-based initiative,"Process fight senior energy. Memory grow send half. Another too mention politics.
Include better drop.",Computer Science,2,Spring,C0282
C0618,Proactive intangible project,Before across south keep. Avoid pretty cause employee different generation deal. Test better quality once region.,Law,4,Fall,None
C0619,Devolved solution-oriented initiative,Day at fine toward southern country. Their catch because capital party near economy lawyer.,Business,4,Spring,None
C0620,Multi-channeled analyzing migration,"Run especially teacher standard experience fly.
Question number eight smile indeed far. Sing girl imagine reveal.",Science,4,Fall,None
C0621,Automated web-enabled extranet,School future half rich media. Move behind hotel serve.,Business,3,Summer,None
C0622,Enhanced optimizing open architecture,Professional far pressure record speech. Member agent let evening citizen travel enter good. Especially part season.,Arts,4,Spring,None
C0623,Polarized bi-directional help-desk,Nation sit daughter left. Question chair thousand rise head write.,Business,3,Fall,C0614
C0624,Public-key solution-oriented access,"Star difficult my among.
Beat director stop upon book still radio bring. Assume national under street just hit which.",Business,2,Fall,None
C0625,Synergized multimedia alliance,"Hotel firm take clearly.
President list she save. Store cold receive. Lead main method since produce.",Medicine,2,Fall,None
C0626,Multi-tiered well-modulated migration,Future red maybe Republican main democratic the. Forward them once position heavy position. Build wear end pick.,Arts,4,Fall,C1786
C0627,Pre-emptive multi-state knowledgebase,"Pattern weight but respond but. Shoulder party amount. Well anyone there let.
Charge reveal moment Congress.",Law,3,Spring,None
C0628,Pre-emptive regional Graphical User Interface,Project I head help when evidence. News yes class back impact customer research probably. Start conference attorney.,Computer Science,2,Spring,None
C0629,Innovative demand-driven architecture,Moment ask worker try. Of five city discover likely article art. Someone resource agency support plan always.,Computer Science,2,Fall,C0010
C0630,Up-sized responsive throughput,"Effort successful no yeah. Individual available consider nothing.
But medical series else image.",Engineering,3,Fall,None
C0631,Fundamental maximized frame,Necessary compare in skin. This above return contain answer argue food policy. Cost crime form popular member.,Computer Science,3,Fall,None
C0632,Team-oriented fault-tolerant firmware,Player along policy game court Republican. Whatever relate group western. Four serious type.,Business,4,Fall,None
C0633,Polarized bifurcated structure,Simply everybody position company thing apply nothing hold. Whom individual until quickly.,Medicine,2,Summer,C0237
C0634,Advanced client-server interface,Night spend cut class take score dog. Store paper a eat call pull whatever.,Arts,3,Fall,C0544
C0635,Virtual exuding capability,Soldier war case meet sport bill. Involve at dog book thank act various.,Computer Science,2,Spring,C1893
C0636,Enhanced 4thgeneration definition,Kid pretty visit hope ability be structure day. Paper walk plan ago outside beat southern. Few live home sport.,Law,2,Fall,None
C0637,Configurable cohesive service-desk,Measure rate partner close develop exist fine.,Science,3,Summer,C0275
C0638,Distributed discrete algorithm,Society newspaper close into thought social.,Computer Science,2,Fall,None
C0639,Proactive dynamic artificial intelligence,Film two so human age. Candidate serious explain gas yet rest yourself.,Medicine,3,Fall,None
C0640,Visionary object-oriented orchestration,Last step write. Good take wish hotel can here relate soon.,Science,4,Fall,None
C0641,Integrated regional throughput,Street way let indeed. Off involve maintain hair seek.,Medicine,3,Summer,None
C0642,Assimilated even-keeled array,Support onto spend turn. Quickly herself attention election but hit. Become heart little generation dark heart wall.,Law,3,Fall,None
C0643,Vision-oriented empowering hierarchy,His finish series western issue blood accept. Sound contain much role produce care.,Medicine,4,Summer,None
C0644,Innovative attitude-oriented superstructure,Hour amount car always according series hope. Attorney success name create.,Arts,4,Spring,C1708
C0645,Multi-layered radical knowledgebase,It bag behind yard attack. Top couple rate rest foot take. Adult fund foot produce center site analysis.,Business,3,Fall,C1321
C0646,Distributed user-facing array,Rock body page evening choose art purpose western. Guy future week southern center me.,Law,2,Spring,None
C0647,Exclusive methodical definition,East where with compare.,Arts,3,Fall,None
C0648,Polarized non-volatile support,Situation prove system culture action account. Eat nation miss three team. Sit represent leader simply serious.,Engineering,4,Summer,None
C0649,Quality-focused contextually-based forecast,"Food situation hour ask well. Place few how. Box while Congress walk.
Quite wish since. His red everyone.",Arts,2,Summer,None
C0650,Open-source 6thgeneration Internet solution,"Save knowledge just contain middle. Mr pass senior candidate remember.
Call debate partner such any.",Engineering,2,Spring,C1051
C0651,Cross-group radical Graphic Interface,"According bed stuff be think. Remember wrong president general.
Also economic six unit since.",Engineering,3,Fall,None
C0652,Balanced bottom-line hierarchy,Use fire bed serve structure describe upon. Week assume film everybody.,Medicine,2,Summer,C1241
C0653,Streamlined responsive approach,Whatever require enough kind. Quickly might yourself. Growth financial prepare base language require.,Science,3,Fall,None
C0654,Phased multi-tasking open system,Edge ball money imagine prevent energy. At road shake new parent necessary.,Business,4,Summer,None
C0655,Seamless systematic projection,Message benefit mention son especially. Speech short tonight quickly young business.,Science,3,Summer,None
C0656,Enhanced needs-based instruction set,Artist chair meet guy. Sense cause trial practice we toward add. Establish mind make probably the.,Computer Science,2,Fall,C1430
C0657,Networked intangible functionalities,Never eye guess couple information soon. Ok ground nearly let.,Science,2,Spring,C1049
C0658,Face-to-face zero-defect capability,Perform sister involve support represent. Notice forget half play like.,Medicine,2,Summer,None
C0659,Decentralized bifurcated throughput,While wife indicate design contain deep. Program offer truth language difficult.,Law,4,Spring,C0174
C0660,Reverse-engineered transitional open architecture,Trip point change start mention three above. Friend necessary detail board. Beat amount series affect art country.,Computer Science,4,Spring,None
C0661,Total 5thgeneration encryption,Simple page sing civil. Lawyer behavior blue become positive.,Science,3,Fall,None
C0662,Function-based motivating attitude,Claim all threat center crime treatment only respond. Plant little war rate.,Law,4,Spring,None
C0663,Multi-channeled 5thgeneration contingency,Anyone risk whose call available ever. Security compare science. Onto form simple not voice government.,Computer Science,4,Fall,None
C0664,Decentralized reciprocal Internet solution,"Record perform population prove.
Woman can traditional. Body far later unit. Everything state fill nearly.",Law,2,Summer,None
C0665,Optional demand-driven knowledgebase,Account well painting account safe book. Last whole prevent reveal tell. The myself suddenly.,Arts,4,Fall,None
C0666,Grass-roots contextually-based circuit,Price common yes include raise develop better. Own his natural crime parent drop.,Medicine,4,Fall,None
C0667,Focused empowering alliance,Seat hospital project moment enter.,Business,2,Spring,None
C0668,Exclusive leadingedge concept,Today guess then condition charge. Current many instead investment order range impact. Have beyond different ground.,Business,4,Fall,None
C0669,De-engineered systemic utilization,Six performance man from. Professor father word later approach sense close. Together ten environment worry.,Law,3,Summer,None
C0670,Pre-emptive disintermediate flexibility,Draw range task expect with. Mention bar wind.,Engineering,4,Fall,None
C0671,Decentralized static architecture,Make seat front risk contain spring tell. Language lose word today. Guy require send young. Large he care sit item.,Engineering,3,Summer,None
C0672,Intuitive foreground conglomeration,Third nor trial little mention. Bring around avoid wide forget either.,Science,3,Spring,C1594
C0673,Proactive dynamic matrices,Hair treatment store yourself rate probably agreement. Among build plan all bit gun. Free model big need ever.,Medicine,3,Fall,None
C0674,Object-based explicit toolset,Race sort reveal large choose. No drop go serve environment condition three live.,Medicine,3,Spring,C1846
C0675,Down-sized eco-centric neural-net,Concern experience business senior interest ever. Ability in help arm work.,Science,4,Spring,None
C0676,Function-based bi-directional architecture,Own general movie college. Hotel both concern peace. Republican answer along indeed allow.,Computer Science,4,Spring,C1315
C0677,Cross-group system-worthy moderator,Data garden end most full. Doctor recently economic ok still special.,Law,2,Fall,None
C0678,Down-sized 24hour protocol,Source recent line school recently half his. War say yes day question whole.,Engineering,2,Spring,None
C0679,Robust exuding Internet solution,Quality ever control today. Policy plan would condition box others soldier. Prevent feeling low you.,Science,4,Spring,None
C0680,Right-sized methodical protocol,"Film rate look trial.
One bar which ready.
Answer factor lawyer yard approach way. Result go course deal card probably.",Computer Science,3,Summer,C0819
C0681,Team-oriented user-facing capacity,Myself push fight product military she. Well meet instead hard wish.,Science,2,Spring,None
C0682,Reverse-engineered systemic concept,Blue color several nation better government. How feel explain wife.,Science,3,Fall,C0226
C0683,Phased human-resource ability,Great if quality standard trouble must shake. Out suffer policy resource head law.,Engineering,4,Summer,None
C0684,Multi-tiered systematic matrix,Sport senior nature. Tax rule care staff part especially.,Engineering,2,Fall,None
C0685,Self-enabling tertiary function,Outside impact expect many. Old per agent perform than.,Business,3,Fall,None
C0686,Reactive empowering projection,Admit reach really we face home. Main sister worry color. Policy discover view last.,Computer Science,4,Spring,None
C0687,User-centric impactful secured line,Machine anything hotel call. Do practice walk what determine fact. Sea itself reach south.,Engineering,4,Spring,None
C0688,Future-proofed motivating capability,Officer kid consumer whose will concern. Control beyond economy.,Medicine,2,Summer,None
C0689,Future-proofed client-server application,Style draw its north. Decide morning money line nature every music.,Science,4,Spring,None
C0690,Cloned intermediate application,As yet almost them condition similar. Full very bank strategy large control success.,Computer Science,4,Fall,None
C0691,Fundamental 3rdgeneration emulation,Week professional positive successful college nation. Clearly professional choice one work soon teach structure.,Medicine,3,Fall,None
C0692,Face-to-face object-oriented interface,Film summer wife. Represent chance get material account no as within. Budget team attack more.,Arts,2,Fall,None
C0693,Future-proofed directional productivity,Responsibility open word happen share capital. Arrive suffer popular value full also.,Computer Science,4,Fall,C0947
C0694,Reactive web-enabled open architecture,Officer case nation here appear. Late fire gun within Congress. Family worker certainly red.,Science,4,Spring,C1610
