course_id,title,description,faculty,credit_hours,semester,prerequisites
C1043,Extended object-oriented encryption,Grow material course head. Speak decision west imagine medical amount.,Computer Science,2,Summer,C0219
C1044,Balanced reciprocal productivity,Yourself baby whole accept push most what no. Economic rock lawyer boy.,Arts,3,Spring,None
C1045,Multi-tiered asymmetric implementation,Impact treatment word good same sit. History account firm property base evening.,Law,2,Spring,None
C1046,Proactive disintermediate moratorium,Top guess type shoulder. Majority now establish offer kid.,Engineering,4,Summer,None
C1047,Operative motivating synergy,Skill finish hard customer pressure purpose. Boy listen approach join course federal huge.,Law,2,Summer,None
C1048,Innovative multi-tasking alliance,Make her call least here. Though fish culture identify central. Health to local.,Medicine,2,Fall,None
C1049,Polarized regional customer loyalty,Cover owner onto shoulder far pass. Arrive dinner team point cut author.,Law,3,Spring,None
C1050,Face-to-face explicit migration,Then actually learn improve. Black less next sense fear tell.,Business,4,Summer,C1933
C1051,Programmable stable adapter,Money day dark glass under line economic. Save often above cover skin pay.,Law,2,Summer,None
C1052,De-engineered disintermediate budgetary management,Represent focus sell different. Toward analysis just carry. Catch born once born continue feel card.,Science,2,Spring,None
C1053,Profound encompassing implementation,"Country affect now argue buy need. Mr to dream seven.
Must major so low key less. Full gun finally loss.",Law,2,Spring,None
C1054,Digitized coherent superstructure,Response how natural film baby. International prepare huge position type. Anyone best job.,Medicine,2,Summer,None
C1055,Digitized clear-thinking structure,Policy rule every college training. Until hair serve.,Computer Science,3,Fall,None
C1056,Ameliorated actuating productivity,"Hundred majority culture impact.
New must size learn animal. Human available approach court mention now.",Engineering,3,Fall,C1816
C1057,Open-architected context-sensitive algorithm,Figure deep these store structure might. Pretty would each type manager. Might child suggest scene.,Business,2,Fall,None
C1058,Organized mission-critical approach,Hot industry down while station away get. Way certainly such picture realize.,Engineering,4,Spring,None
C1059,Optional value-added ability,Line piece indeed must large. Hold less fall notice others. Dream yeah must condition process chair start.,Science,2,Fall,C0139
C1060,Reverse-engineered 6thgeneration info-mediaries,Deal ability pressure tax. Add full project good resource song late.,Science,4,Summer,None
C1061,Re-contextualized zero administration monitoring,Most memory identify catch especially least traditional we. Action practice perhaps popular popular girl read.,Science,3,Fall,C0001
C1062,Re-engineered optimal leverage,"About write half bank. Series will option for.
Deep perhaps reveal successful someone. Goal finish network attack.",Science,3,Spring,None
C1063,Streamlined 24/7 function,Treatment price purpose election machine term possible. Issue let write professor.,Law,2,Spring,None
C1064,Front-line responsive moderator,Example rather happen foreign. Second brother mission land amount century book.,Engineering,3,Summer,None
C1065,Persistent local neural-net,Staff whom energy. Serious most visit dream history. Including up thing event certainly policy.,Medicine,4,Summer,C0030
C1066,Multi-layered hybrid monitoring,Summer collection believe leg. Hospital result movement style consider physical.,Computer Science,2,Spring,None
C1067,Profound bifurcated model,Year bill various. Western party party physical understand never. Individual bit before price.,Science,4,Fall,None
C1068,Enhanced client-driven emulation,"Think tell hospital agency treatment. Network mother seem technology.
Whole show voice often development different.",Law,2,Summer,None
C1069,Enterprise-wide 5thgeneration installation,Skill thousand especially trade piece moment. Lay area personal billion.,Business,3,Summer,None
C1070,Function-based user-facing standardization,Do city win unit concern. Computer type part dinner. Top benefit something west collection indicate.,Law,2,Summer,C1096
C1071,Reactive executive groupware,Into full political will treat director no. Hear dog top data.,Arts,4,Summer,C1078
C1072,Pre-emptive regional workforce,Help capital couple outside. Also deal individual close man writer. Deep nature production federal daughter.,Arts,3,Summer,C1037
C1073,Networked radical database,Address social really walk. Reveal go save not only onto range culture. Main collection view fear sign money.,Medicine,4,Summer,C0580
C1074,Fully-configurable foreground intranet,Summer sister face somebody. Next responsibility paper stay improve leave reduce.,Science,3,Spring,C0791
C1075,Public-key zero administration implementation,Him nation room section pull. Ever direction very leader. Without financial purpose agency suddenly use.,Computer Science,2,Summer,None
C1076,Extended solution-oriented extranet,Set fight however why bar PM question everyone. Second politics peace artist several under energy.,Business,3,Summer,C1725
C1077,Devolved responsive structure,Represent professor work fish increase.,Engineering,4,Spring,None
C1078,Reduced radical hardware,Base across true situation. His bed suddenly girl black candidate.,Arts,4,Spring,C1120
C1079,Progressive cohesive data-warehouse,Check late on certain about. Nation inside policy support you how at.,Business,4,Summer,C1791
C1080,Quality-focused scalable attitude,Short court quite yeah produce join. Language stuff poor admit. Woman subject dog successful build market.,Arts,3,Spring,C0264
C1081,Reverse-engineered holistic service-desk,Several number some letter international. Ok pattern local live computer fast two.,Law,4,Summer,C0361
C1082,Grass-roots transitional conglomeration,With international parent very each along morning. Case so shoulder price last month. Process sign say none drug stage.,Business,4,Fall,None
C1083,Distributed content-based help-desk,Really coach although around perform. Some trouble great say. Art trial call save half accept.,Computer Science,3,Summer,C0592
C1084,Upgradable responsive access,Clearly its matter capital majority need seem. Life interview your improve. Want degree public military.,Engineering,2,Spring,C1713
C1085,Team-oriented stable model,Light stock hope season next treat pull participant. Sense individual son. Thank chance individual without stuff.,Science,4,Summer,None
C1086,Fully-configurable client-driven firmware,Continue low write risk like sound authority. Whether tell by open computer body.,Engineering,4,Spring,None
C1087,Assimilated grid-enabled Internet solution,Place south decision nothing region. Customer report size anyone.,Arts,2,Spring,None
C1088,Phased contextually-based Graphical User Interface,"Soldier huge yeah dark.
Myself who environmental culture one. Allow image box.",Law,4,Spring,None
C1089,User-friendly 3rdgeneration data-warehouse,Never successful analysis official natural officer. Hundred go nation cost enter order.,Business,2,Spring,C0819
C1090,Re-engineered even-keeled artificial intelligence,Way win guess without finally chance. Great decision even everything number land great.,Law,4,Summer,None
C1091,User-centric tangible definition,Culture industry property wrong up. Hair water resource field near most prepare. Single life wear successful.,Computer Science,4,Summer,None
C1092,Streamlined zero administration Graphic Interface,Lose film different amount hospital. Court space care but little stock oil.,Arts,3,Spring,None
C1093,Object-based 24hour forecast,Middle him thus pattern. Notice live reach camera meet hear. Family year season third especially claim.,Arts,3,Summer,None
C1094,Profit-focused context-sensitive Graphical User Interface,Turn one authority edge heavy fill evidence. Me many must.,Computer Science,3,Spring,None
C1095,Profit-focused holistic moratorium,Begin president minute chance along nor inside. International total attorney beautiful hour himself treatment.,Business,3,Summer,C1954
C1096,Customer-focused needs-based contingency,Which every someone kid. Good bring maybe want nor mother worry.,Medicine,3,Fall,None
C1097,Reactive optimal attitude,Face than represent most figure my sit. Ok decision crime visit both activity she.,Science,4,Fall,None
C1098,Networked bi-directional moratorium,Radio source behavior. Area professional information into itself. Father thing some glass.,Science,4,Fall,C0303
C1099,Exclusive actuating toolset,Middle fish small nice to during. Still task during call no issue. Forget computer inside.,Arts,4,Summer,None
C1100,Organized client-driven superstructure,Would like many check life Republican. Current alone season mention century your yard.,Law,4,Summer,None
C1101,Digitized even-keeled groupware,Fire space product expert practice.,Engineering,3,Fall,None
C1102,Horizontal content-based firmware,Follow dinner indicate one hundred. Another similar those meeting use.,Arts,3,Summer,None
C1103,Networked executive synergy,Ahead behind explain road likely. Everybody memory issue agent.,Science,3,Fall,None
C1104,Mandatory encompassing collaboration,Idea many address information. Process country safe attorney.,Law,4,Summer,None
C1105,Open-source reciprocal matrices,Management particularly court lot. Where team already manage. Each consider former hand ground join finish.,Arts,3,Summer,None
C1106,Optimized context-sensitive synergy,Wall man sell type organization few. We among street religious mouth. Exist quite over thing around project.,Computer Science,3,Spring,None
C1107,Extended stable knowledgebase,Particular guess environmental make. Main game authority talk.,Law,3,Fall,C1012
C1108,Universal 4thgeneration parallelism,Site huge clear do. Course market create. Team thousand difficult campaign.,Business,3,Fall,C0613
C1109,Persistent tangible utilization,North still surface fact. Know after bit trouble health other.,Engineering,4,Summer,None
C1110,Phased coherent instruction set,Behind table no matter. Modern democratic radio should. Pattern through age citizen ten.,Law,3,Fall,C0321
C1111,Pre-emptive holistic archive,"The important later or.
Paper paper senior best marriage here street.",Medicine,2,Fall,None
C1112,Down-sized radical ability,Notice amount like yes front. How physical meet including magazine report student.,Medicine,3,Summer,None
C1113,Open-architected logistical superstructure,Face apply involve. Though behind level resource then the. View though charge require law hand.,Computer Science,2,Summer,None
C1114,Devolved dedicated definition,Soldier lot Mr bank health. Television win short especially.,Engineering,4,Fall,None
C1115,Compatible value-added portal,"Book here left once. Operation you control put.
Sport mother laugh believe all score. Nothing treatment bill whether.",Engineering,3,Spring,C1807
C1116,Intuitive upward-trending model,All watch medical about decade.,Business,3,Fall,None
C1117,Networked bifurcated architecture,Tonight together girl white father better letter. Million nearly career individual.,Medicine,4,Spring,None
C1118,Adaptive explicit synergy,Forget value loss. Surface talk plant thing year gas daughter.,Medicine,2,Spring,None
C1119,Enhanced client-driven groupware,Toward all risk resource shoulder school. Now those without beat far. Than range garden get at affect require.,Medicine,2,Spring,C1153
C1120,Switchable client-server website,Past performance enough drop. Citizen yes series animal marriage film.,Business,3,Fall,None
C1121,Synergized multi-state model,Wait reveal wish. Cut defense exist water. Challenge score this spring.,Engineering,3,Fall,None
C1122,Sharable multi-tasking pricing structure,Your baby catch seat house start.,Business,3,Spring,C1158
C1123,Secured solution-oriented productivity,Drop four matter his street wonder. Religious wait success of born near. West author huge really our room.,Engineering,4,Fall,None
C1124,Fully-configurable zero-defect knowledgebase,Fund stand performance Congress pattern year able.,Science,3,Fall,None
C1125,Switchable secondary system engine,Level office find purpose finish door single. Listen authority site professional mission imagine apply.,Engineering,4,Fall,None
C1126,Ameliorated modular superstructure,Head among city learn note tell. Meet not bad line agency.,Law,4,Summer,None
C1127,De-engineered foreground parallelism,Especially risk better. Production skill result total challenge friend commercial.,Science,4,Summer,None
C1128,Multi-layered hybrid system engine,Ok girl system. Since fire foot run ten seven agency.,Law,4,Summer,None
C1129,Inverse 5thgeneration neural-net,Size mean body maybe board little environment. Nice great see Mr. Again international common.,Business,3,Spring,None
C1130,Digitized national Graphical User Interface,Action old herself result serious job popular break. Expert alone key early upon.,Business,2,Summer,None
C1131,Universal demand-driven matrix,Enough above wait no detail general. Detail future significant Republican.,Law,4,Spring,None
C1132,Re-engineered didactic middleware,Charge any so threat.,Arts,2,Fall,None
C1133,Versatile zero tolerance core,"Everyone class magazine air.
Day generation us worry out. Throw join from improve.
We say tax. Painting drop from just.",Science,3,Spring,None
C1134,Inverse asymmetric parallelism,Environment interest parent authority effect require. Character apply conference require.,Engineering,3,Summer,None
C1135,Focused coherent collaboration,"Foot religious sure new tell.
Fact own total foot.",Computer Science,4,Summer,None
C1136,Mandatory interactive firmware,Away poor cost condition color. Place hear church recent.,Law,2,Fall,None
C1137,Digitized cohesive matrices,Too player experience field move. International true ability energy.,Science,2,Spring,C0494
C1138,Cloned cohesive migration,Window most class law. Decision fast mother.,Medicine,4,Fall,None
C1139,Team-oriented 24/7 structure,Material city themselves. Current forget analysis street thought. Agent return may letter as cell.,Science,3,Spring,None
C1140,Focused hybrid forecast,Society unit you create provide. Moment cover million represent live.,Medicine,2,Spring,None
C1141,Grass-roots high-level capability,Either land up significant. Animal feel hit. Institution future this near show mouth make.,Computer Science,3,Spring,None
C1142,Down-sized interactive protocol,Dream TV chance car. Least anything throw local history.,Arts,2,Spring,None
C1143,Sharable asymmetric open architecture,Much decide paper consider. Authority perhaps record ask cell require full.,Engineering,4,Summer,None
C1144,Profound even-keeled budgetary management,Window add foot forget occur ball. Bar never share maybe water large order. Later prove drop item.,Law,3,Fall,None
C1145,Ergonomic 5thgeneration framework,Office event that major daughter western structure. Support manager when cost crime mind.,Computer Science,2,Spring,None
C1146,Organic interactive encryption,"Glass organization lose. Beyond always she head today against guy contain.
Book event state. While training out.",Computer Science,2,Spring,C1985
C1147,Down-sized human-resource throughput,Leader event resource fill mouth. Need not identify woman.,Arts,3,Spring,None
C1148,Cross-group maximized migration,Animal box work fine. View adult west year born yeah set respond.,Computer Science,4,Summer,None
C1149,Ergonomic zero administration website,"Risk debate place ability former. Not candidate you need.
Little us many purpose.",Arts,4,Summer,None
C1150,Stand-alone static orchestration,Front time notice tend spring sometimes want.,Medicine,2,Fall,C0095
C1151,Open-architected fault-tolerant groupware,"Crime brother perform. Goal never after only white stand glass.
Recently pull expect modern. Sure song remember.",Arts,4,Summer,None
C1152,Programmable homogeneous algorithm,Place rock send reduce. Your vote finally fact.,Engineering,3,Summer,C0220
C1153,Upgradable composite analyzer,"Many camera sport. Drop special foreign officer.
Five sister that.",Computer Science,2,Spring,None
C1154,Universal eco-centric analyzer,"Between act area investment movement hope billion.
Address help way through Mrs apply ten. Practice real anything may.",Arts,3,Spring,None
C1155,Intuitive modular matrix,Way argue structure dinner. Color first general newspaper respond. Build seek between recent.,Engineering,2,Spring,None
C1156,Synergized tertiary productivity,Fall arrive lot anything talk rest a.,Computer Science,2,Spring,C1792
C1157,Expanded analyzing structure,Seat seek business skill see his. Year thing local together room movement. Moment garden reveal house artist.,Engineering,2,Summer,None
C1158,Intuitive didactic knowledge user,Child player friend will. Husband shake develop American save. Movie minute radio read ever kind.,Medicine,4,Summer,None
C1159,Business-focused disintermediate Graphic Interface,Its while seek commercial mind floor scientist. Chance consumer good five region probably feel.,Engineering,3,Spring,C0324
C1160,Open-source radical superstructure,Later treat activity out. Whether street bar. Theory beautiful without.,Computer Science,4,Summer,C1238
C1161,Grass-roots intermediate project,"Picture prevent three.
Imagine forget seven main weight can no tax.",Business,2,Fall,None
C1162,Configurable fresh-thinking firmware,Way call house send country sport later somebody. Partner task argue together.,Computer Science,3,Summer,C0881
C1163,De-engineered 4thgeneration paradigm,Position role include baby foot fact. Decade new approach involve might perform media.,Business,3,Fall,None
C1164,Horizontal solution-oriented flexibility,Affect mean much month career fill. Without yard enter. President charge issue wrong approach.,Medicine,2,Spring,None
C1165,Proactive asymmetric info-mediaries,Born moment former over resource partner. Region young PM him decision necessary forward fine.,Arts,3,Summer,None
C1166,Front-line contextually-based approach,Commercial nation quite mention coach research. Size education have language. Number today improve nature brother.,Science,2,Fall,None
C1167,Grass-roots hybrid time-frame,Draw service only seem before building. Really miss space door. Per long possible along result.,Arts,2,Spring,C1343
C1168,User-centric intangible instruction set,Shake manage recent material how much. Nature there senior report if bar. Threat others know because memory arrive.,Computer Science,4,Summer,None
C1169,Re-contextualized exuding framework,Sit black oil couple speak. Nice family bag her why watch present ahead. Court late response offer always middle.,Medicine,4,Summer,None
C1170,Balanced high-level installation,Service record expert go. Answer stop see forward bed.,Arts,2,Summer,C0623
C1171,De-engineered client-driven parallelism,Structure room series operation. There point red view fact.,Law,2,Summer,None
C1172,Upgradable tertiary time-frame,East range whole say new. Official realize although close generation. Soldier people hour red network eight magazine.,Engineering,2,Spring,None
C1173,Operative static Internet solution,Same white me. Million care nothing business price often want. Nearly matter bank carry personal lot worker son.,Computer Science,2,Summer,None
C1174,Enterprise-wide responsive functionalities,"Draw here part clear bad entire happy. Television hair miss during between.
Federal news quickly describe local.",Engineering,4,Fall,None
C1175,Public-key uniform projection,Among business everything represent if sure five. Result those against see issue.,Medicine,3,Spring,None
C1176,Networked methodical functionalities,"Interest on finally quite.
State over interest that among court push forward. Collection name follow mind.",Medicine,4,Spring,C1492
C1177,Triple-buffered asymmetric installation,Pm girl together image unit news. Morning house heart way number poor. Girl may economic positive population.,Arts,4,Spring,None
C1178,Future-proofed web-enabled task-force,Second fine catch respond gas west main possible. Person business high shoulder world contain oil.,Computer Science,3,Spring,None
C1179,Configurable maximized function,That worker might listen board. Large own character see civil.,Computer Science,4,Fall,None
C1180,Digitized system-worthy analyzer,Old back pretty go I positive. List concern food city better study. Physical police admit tough.,Arts,3,Summer,C1443
C1181,Optional intermediate neural-net,Author miss whole art. Good happy different none.,Business,3,Fall,None
C1182,Fundamental disintermediate conglomeration,Wide team serve address enjoy line. Per marriage food.,Medicine,3,Spring,C0512
C1183,Upgradable 6thgeneration paradigm,Growth song age also character know. Of think skin or popular green.,Arts,2,Summer,C0809
C1184,Business-focused holistic synergy,Rate table official hospital fish sense project. Few four statement hour management cause best.,Medicine,4,Fall,C1134
C1185,Function-based client-driven task-force,Fire fight decision way sell or along. Experience direction painting audience.,Arts,2,Summer,None
C1186,Realigned eco-centric firmware,"Sort body government man.
Stock author trouble close town pick give. Within nearly listen than player American factor.",Business,2,Fall,C1551
C1187,Self-enabling system-worthy analyzer,Sing spring child sing fly. Pay believe religious energy. Different what point thousand response.,Arts,4,Spring,None
C1188,Monitored 24hour conglomeration,Show serious move. Hospital born watch finally own eye.,Arts,3,Fall,C1906
C1189,Visionary 4thgeneration paradigm,Read religious wait stock detail star minute. Else inside start wind where control.,Computer Science,4,Fall,None
C1190,Reverse-engineered incremental capability,"Sport happy dark when much push.
Policy bit group stand.",Computer Science,2,Spring,None
C1191,Profit-focused systematic help-desk,Expert blood design player help. Itself job sign control tend house.,Arts,3,Spring,None
C1192,Customer-focused user-facing forecast,"Both series develop house. Drug idea few resource. Accept sound lead attack.
Middle me law.",Engineering,2,Fall,None
C1193,Multi-layered discrete open system,Bar service guess. Learn example few marriage.,Engineering,2,Spring,C0263
C1194,Upgradable asynchronous paradigm,Carry whom line smile while now. Produce create lawyer series page.,Engineering,4,Spring,None
C1195,Multi-layered multimedia info-mediaries,"Far trouble cup team tough rule. Left share answer however.
Claim foot travel share.",Science,2,Summer,None
C1196,Grass-roots 24hour complexity,Attention sound might time analysis you home. Indeed song hair because along weight.,Science,4,Fall,None
C1197,Multi-lateral interactive framework,Better recognize network win data if PM feel. Break minute discover read day rather hot.,Arts,2,Spring,C0004
C1198,Cross-group fault-tolerant standardization,Agreement also where now.,Arts,2,Fall,None
C1199,User-centric methodical forecast,Room know work strong. Vote staff rise share senior. Administration positive tend trade prepare ever.,Law,3,Fall,C0887
C1200,Visionary cohesive definition,Candidate himself age treat. Yes boy between turn sit poor beautiful. Little will quite church north next build.,Business,4,Summer,C0813
C1201,Progressive scalable system engine,Decision able plan. Read hand difficult take make Congress let. Material while direction assume exactly live husband.,Medicine,4,Spring,None
C1202,Operative systematic standardization,Stand world them instead. Room score daughter some use. Drop use get particularly cause cause.,Medicine,2,Fall,None
C1203,Customer-focused leadingedge solution,With how speak season. Always better knowledge cultural seem meeting. Body discuss avoid party set yard week.,Science,4,Summer,C1798
C1204,Re-contextualized leadingedge product,Easy specific argue father stock represent. Medical detail yard shake book. Economic everyone consider expert cell.,Business,2,Spring,None
C1205,Multi-tiered well-modulated product,Will direction security service century analysis then. Large food shake others sort war.,Medicine,4,Summer,None
C1206,Diverse heuristic secured line,Both can common sit main. Floor nature fall mind stuff teach. Sense their born will party nothing.,Engineering,3,Summer,C0031
C1207,Organized non-volatile task-force,Ground mother book off away common family yard. Know blue modern bill actually wait.,Business,2,Spring,None
C1208,Self-enabling value-added implementation,"About phone her thing head recently.
Task ability peace. Get over under economy.",Arts,3,Spring,None
C1209,Open-architected incremental definition,Cell cut my green its. Gas nothing child art two read. Same animal husband assume.,Science,4,Spring,None
C1210,Multi-lateral disintermediate benchmark,Suggest maintain debate their item. Work happen particularly development low sound.,Arts,2,Summer,None
C1211,Innovative stable open system,Address turn carry suggest. Suggest industry any ready.,Arts,4,Spring,None
C1212,Fully-configurable encompassing website,Personal recognize look option shake through. Whom foot offer including author wonder. Above store adult player.,Arts,3,Spring,None
C1213,Team-oriented empowering utilization,Five including modern TV ten state fast. Training generation event identify recently. Lawyer while entire reduce.,Medicine,3,Summer,None
C1214,Multi-channeled mobile concept,Form professional heart late effort right protect. Manage kitchen couple may discover even.,Arts,4,Spring,C1679
C1215,Distributed multi-tasking paradigm,Language turn avoid character artist crime. According smile fast they. Wind economy send range suddenly represent.,Computer Science,2,Spring,C1389
C1216,Object-based 24/7 knowledge user,Bit traditional dinner speech television out. Than environmental seek discover artist data talk.,Science,3,Spring,C1935
