course_id,title,description,faculty,credit_hours,semester,prerequisites
C1393,Ameliorated tertiary frame,Above whole want lot these table sure.,Engineering,4,Summer,C0518
C1394,Self-enabling methodical hierarchy,Protect enter talk environmental. Record us former our.,Business,3,Fall,None
C1395,Ameliorated impactful concept,Source treat hand. Will low raise artist. Bed service natural recognize. House structure north middle.,Business,2,Spring,None
C1396,Fully-configurable mission-critical encoding,Hope mother couple drop. Director take big yet ability west edge. Should should source lawyer environmental rule.,Medicine,3,Spring,None
C1397,Customizable real-time focus group,Large daughter someone value subject determine speak. Art media live discussion fear he couple. Today effect service.,Medicine,2,Summer,C0334
C1398,Ameliorated even-keeled approach,Develop never individual dark over. Turn out front our factor ago avoid lawyer.,Engineering,4,Fall,None
C1399,Customer-focused contextually-based methodology,Same student apply go arm factor fund such.,Science,3,Fall,None
C1400,Digitized encompassing attitude,President nearly already concern green might. Unit morning if simply. Camera position him front.,Business,3,Fall,C0526
C1401,Decentralized object-oriented support,Various draw road everyone for. Conference authority evidence blood yeah however.,Science,4,Spring,C1139
C1402,Programmable needs-based artificial intelligence,Floor low remember move Congress. Picture nothing national involve even worry father.,Business,3,Summer,None
C1403,Function-based object-oriented projection,Line base term poor. Create investment change travel six until PM. True argue range shoulder.,Law,3,Spring,None
C1404,Reactive responsive open system,Evening manage better. Feeling wind door imagine. Outside require us response.,Science,3,Fall,None
C1405,Sharable systemic analyzer,Each attack tree writer. President charge that school star join leave.,Business,4,Spring,None
C1406,Implemented zero administration hierarchy,Ground face month decade quality. Claim film on action south. Majority available American office home add show.,Law,4,Spring,None
C1407,Configurable intermediate product,Watch even campaign former. Determine though option sometimes lose still. Race away sea.,Science,2,Spring,None
C1408,Total responsive synergy,Natural speech book read. Hot property near energy walk activity lot.,Medicine,4,Fall,C0988
C1409,Persistent scalable structure,Fact program me individual bar born. Nation instead spend price.,Law,3,Summer,None
C1410,Profound exuding groupware,Ground human half late collection debate. Statement back current maintain. Wrong church miss attorney. Early us yes.,Business,4,Fall,None
C1411,Profound user-facing strategy,Less must science. Reality wind option site reason firm onto.,Business,3,Fall,C1450
C1412,Enhanced dedicated hierarchy,Situation fight film commercial way allow sure. Perform its far hotel plan majority.,Science,4,Fall,C0577
C1413,Reverse-engineered global core,Alone color a public. Cut stand knowledge cold.,Arts,4,Summer,None
C1414,Secured background algorithm,Face treatment especially out woman final wear. Crime reason set management by.,Computer Science,4,Spring,None
C1415,Devolved motivating interface,Radio board strategy time to detail free. Build pay effect bag.,Law,2,Summer,None
C1416,Multi-lateral clear-thinking hub,Not stand word course speech still. Civil management morning position. To anyone inside discuss security security.,Engineering,4,Spring,None
C1417,Synchronized full-range installation,Market color note activity middle suggest. Far house each Congress. Cause life face a ahead line some onto.,Engineering,3,Fall,None
C1418,Versatile 5thgeneration methodology,"Election lawyer happen. Reflect exactly position.
Participant program medical seven. Purpose field particularly.",Business,3,Spring,C0298
C1419,Reactive zero administration analyzer,Time future floor worry weight young majority. Enter third test teacher. Trade view student good.,Computer Science,2,Fall,None
C1420,Re-contextualized heuristic model,Lawyer teach economy. Painting check dark from if happen return anyone.,Arts,3,Fall,C0025
C1421,Centralized incremental benchmark,Figure develop you give hear. Grow on yet worker only far.,Computer Science,4,Summer,None
C1422,Digitized multimedia encryption,"Whether region office force forward. Effort left agree dog now.
No mean traditional fact son body.",Computer Science,2,Fall,C0908
C1423,Realigned bottom-line database,Again none none board information spend. Theory occur mother race next. You others arrive low single whose line.,Science,2,Spring,C0680
C1424,Operative modular knowledge user,"Oil idea way glass. Alone security fact box day billion.
Lose education candidate or character safe expect.",Science,2,Fall,C1784
C1425,Optimized interactive website,Glass audience customer. Since will require job unit officer Congress west.,Engineering,2,Fall,None
C1426,Innovative bifurcated capability,Ten two nothing operation start child spring. Minute music man throw computer program visit.,Medicine,3,Spring,None
C1427,Distributed multimedia open system,Thought usually culture mission current seven several bit. Major what there fall along. Hard three marriage really.,Business,4,Spring,None
C1428,Networked national policy,History positive admit picture everything develop. Experience son full be. How we education.,Arts,2,Summer,C1659
C1429,User-centric bottom-line protocol,Red series heavy author prevent fact. Effort opportunity save lawyer almost history.,Science,2,Fall,None
C1430,Versatile bottom-line focus group,Industry reveal rest right worry particular. Sit team hot out project.,Engineering,4,Spring,C1236
C1431,Fully-configurable eco-centric infrastructure,"Point project fish politics baby per. Heavy stage run clear hotel be.
Read sort few easy partner well care claim.",Engineering,3,Fall,None
C1432,Public-key transitional architecture,Many discussion current various talk radio everybody. Player fly school two research. Strategy unit machine.,Engineering,3,Spring,None
C1433,Progressive methodical success,Stop wrong include material. Bar east head without.,Law,2,Fall,None
C1434,Business-focused well-modulated moderator,This resource safe response night those. Imagine use strong crime lay Mr.,Business,3,Spring,None
C1435,Innovative uniform database,Enough less professional wonder. Live page stand skill we. Less fight rise tree. Beat PM method skill authority create.,Arts,3,Fall,None
C1436,Profound solution-oriented website,Citizen group fast choice. Take food environmental executive late woman public.,Science,4,Summer,C0142
C1437,Optimized 24hour infrastructure,"Democrat yet consider me. Approach serve important company position nor.
Southern performance line dinner seem.",Engineering,4,Fall,None
C1438,Adaptive content-based knowledgebase,Choose argue pass same the ever. Owner them also. Fly yeah now network.,Law,3,Spring,C0355
C1439,Virtual bandwidth-monitored Graphic Interface,Building everybody both after strategy. Half fall Mr black.,Engineering,2,Fall,C1402
C1440,Synergistic upward-trending adapter,Finish operation today little though important civil decide. Name trouble become.,Medicine,3,Summer,C0561
C1441,Multi-layered mobile installation,Test may prepare avoid. Sea simply research hair school. Director avoid arrive middle guy. Today we us amount instead.,Medicine,4,Spring,None
C1442,Pre-emptive coherent secured line,Rule drug her peace general also news. Bank guy wall they even law.,Science,2,Fall,C1989
C1443,Optimized multimedia Local Area Network,Brother house should hair every spring reality fine. Assume ago ready design.,Arts,4,Fall,None
C1444,Versatile heuristic capability,Note government himself long office.,Engineering,2,Fall,None
C1445,Phased object-oriented concept,Notice someone themselves. Their staff product choose continue couple.,Business,3,Spring,None
C1446,Diverse demand-driven core,Change water situation soon seat. Discuss six customer black shake. Central three never join woman avoid.,Computer Science,3,Fall,C0641
C1447,Intuitive neutral benchmark,Family standard already tell. Where difficult everyone language per chair door.,Computer Science,3,Summer,None
C1448,Implemented modular process improvement,Seven act six small discuss. Role same security manage enough water. Much lead three conference environmental.,Arts,2,Fall,None
C1449,Polarized disintermediate orchestration,Line enjoy city manager.,Law,2,Spring,None
C1450,Face-to-face grid-enabled monitoring,Play one blood speak figure recently certainly. Once maintain baby against vote everybody on hit.,Science,3,Spring,None
C1451,Synergized neutral info-mediaries,Sell may most eat goal successful. Back heart international me several author. Season herself ability worry.,Medicine,4,Spring,None
C1452,Pre-emptive fresh-thinking algorithm,Small continue conference sometimes discuss. Pretty agency major option center.,Law,4,Spring,None
C1453,Innovative analyzing groupware,Kid use authority someone name full. Indicate across late agency including.,Business,3,Summer,None
C1454,Self-enabling 24/7 initiative,"Mouth health with evidence station everyone. Car suffer these.
Start drug throughout help.",Engineering,3,Summer,None
C1455,Decentralized real-time initiative,Citizen news author culture section. Through turn our forget.,Science,4,Summer,C0105
C1456,Versatile demand-driven portal,Rock garden hospital suffer. Beautiful cell matter. Require similar environmental hold size executive.,Medicine,2,Fall,None
C1457,Diverse optimal attitude,Article answer pressure thought side less finish. Your none whatever perhaps.,Engineering,3,Spring,None
C1458,Centralized bandwidth-monitored initiative,"Small center seat. Cell help resource maybe.
Animal do hit look board gas. Them must industry whatever include.",Law,2,Summer,C0487
C1459,Programmable coherent project,Will even near short. Teach police international rate think break capital particularly. Raise central visit staff.,Science,2,Spring,None
C1460,Polarized 5thgeneration superstructure,Since discussion glass beat fine. Forget eight why however through adult.,Engineering,2,Spring,None
C1461,Organized 4thgeneration application,"Eye career not.
Best much try away message write. Voice amount prove particularly whom.",Business,2,Summer,None
C1462,Networked non-volatile workforce,Sense surface avoid draw miss. Owner nearly send yeah price plan.,Engineering,4,Spring,None
C1463,Organized asymmetric matrix,Person already join.,Medicine,3,Summer,C1169
C1464,Enhanced directional orchestration,Table house article yes positive per term. Season just already their.,Business,4,Spring,None
C1465,Ergonomic exuding interface,Reach where share to Democrat however commercial. Receive blood debate my.,Computer Science,3,Summer,None
C1466,Up-sized fresh-thinking process improvement,True develop business end. Explain they rock tree.,Engineering,2,Spring,None
C1467,Object-based executive data-warehouse,"Part score wrong present.
Water politics summer single able. Both authority assume staff recent.",Law,3,Spring,C0066
C1468,De-engineered logistical strategy,Fall growth force set hold maintain. Institution consider write space same present.,Law,3,Spring,C0330
C1469,Mandatory high-level initiative,Energy threat every head recent money. East option tonight issue they.,Arts,2,Fall,C1791
C1470,Synergistic context-sensitive concept,Magazine end move region second serious determine. Four know wonder it war body.,Science,3,Summer,C0656
C1471,Intuitive cohesive interface,Truth some ten entire investment tree list. Price process still group think.,Law,3,Fall,None
C1472,Phased fault-tolerant budgetary management,"Edge large defense itself air middle security decide. Author fine your against alone.
Moment deep son discussion.",Arts,2,Fall,None
C1473,User-friendly logistical firmware,Magazine nearly produce. Defense law arrive. Hundred drug become.,Science,2,Fall,C0348
C1474,Ameliorated client-server knowledge user,Forget peace young trial for. Walk west center. Leave share price wish serve early them.,Engineering,2,Fall,None
C1475,Cross-platform client-driven parallelism,Many phone tonight stop real nothing after. Try western forget city space. Range national new both.,Law,3,Summer,C0043
C1476,Inverse stable instruction set,Story about sea man. Book bill training anything. Second billion approach rest.,Computer Science,3,Spring,None
C1477,Multi-tiered human-resource middleware,"Paper beat seem. Thus full sort he.
Situation out reach everybody. Professor head know dog bank issue ground soon.",Law,2,Spring,C0126
C1478,Progressive national model,Itself weight occur hand business sea. Later against state everything wall.,Business,3,Summer,None
C1479,Re-engineered upward-trending array,Performance sea material different. Business rate manage truth north girl community. Ago security true laugh.,Science,2,Spring,C0766
C1480,Innovative zero tolerance intranet,Movie there prevent customer attorney. Range example race indeed recent model.,Computer Science,2,Spring,None
C1481,Fully-configurable bifurcated software,Again thank pattern sure myself range among. That third analysis effort over. Admit help office way goal.,Arts,3,Spring,C1451
C1482,Distributed mobile functionalities,News card campaign. Body determine training into major heavy.,Engineering,2,Summer,C0808
C1483,Sharable foreground workforce,Read student meeting. Glass road candidate turn interview area modern long.,Science,3,Spring,C1283
C1484,Optional real-time encryption,Claim sea energy must whether power. Interest organization suddenly discussion administration.,Medicine,3,Summer,C0305
C1485,Synergistic tangible knowledge user,Argue true place baby carry. Floor win bill. Line above write claim yet beat candidate.,Engineering,4,Fall,None
C1486,Assimilated responsive challenge,Politics language town own rule. Off away behind person bit friend attorney.,Science,4,Summer,C1811
C1487,Innovative composite parallelism,Beat cup nation product foreign sound myself have. Wish and responsibility wait dark. Body perform truth.,Law,2,Spring,None
C1488,Extended client-server website,Make likely step myself whose. Debate support situation its daughter charge scientist check.,Engineering,3,Summer,C0099
C1489,Re-engineered intermediate interface,Budget meet enter pretty determine firm your.,Engineering,2,Spring,C1761
C1490,Down-sized tangible concept,School center animal. Phone among deep skin. Tax according must age ok artist girl truth. Stock season kid coach easy.,Science,4,Summer,None
C1491,Right-sized secondary Local Area Network,"State blue company relationship of.
Fast grow protect rather think central. Action area land environmental.",Arts,4,Spring,C1544
C1492,Open-source needs-based extranet,Camera increase give trip listen this. Model nature those various amount.,Business,2,Summer,C1205
C1493,Extended intangible attitude,Dark ten century myself. Election wind goal save.,Business,2,Spring,None
C1494,Exclusive non-volatile complexity,Team although official outside evidence. Lead event later especially. Attention up yes hit meet charge.,Engineering,2,Spring,None
C1495,Extended actuating hub,Parent nation tough. Hand more site allow. Writer wait bank area carry. Lay yard walk whose.,Law,4,Spring,C1457
C1496,Diverse encompassing database,Subject people finish song heavy. Factor myself manage ever ball. Use beautiful take adult arrive think.,Computer Science,4,Spring,None
C1497,Persistent asynchronous flexibility,Rate it policy. Sister campaign bank difficult position happen today. Purpose nation partner share guess trial huge.,Engineering,2,Fall,None
C1498,Fully-configurable contextually-based data-warehouse,Sell apply everything senior. Ahead up operation economy company. Future child them.,Law,2,Fall,None
C1499,Fundamental regional portal,Let office large activity. Open least idea accept.,Medicine,3,Fall,None
C1500,Triple-buffered interactive implementation,Finish body ok authority much western yes.,Arts,4,Fall,None
C1501,Versatile foreground firmware,Offer beautiful or little who. Cup guess enough hot until. Final rate national energy house son.,Computer Science,4,Summer,C0755
C1502,Reactive fault-tolerant alliance,Someone performance customer design at idea. Law film could remain last our six.,Computer Science,4,Spring,None
C1503,Team-oriented maximized model,Form paper drop clear soldier. Cause water event between.,Engineering,4,Spring,C0985
C1504,Decentralized multi-tasking collaboration,Gun station kid rock sister relationship. Congress child part account wrong might financial.,Engineering,2,Spring,None
C1505,Open-source intangible intranet,Yard edge interest. Page mission represent case over data. Stay word career rule our. Movie move be.,Arts,2,Summer,C0694
C1506,Integrated global functionalities,Phone fly attention player. Throw cost notice believe series. Agreement their cultural fall lot again.,Medicine,3,Fall,C0820
C1507,Profit-focused attitude-oriented focus group,Analysis generation born along. Simply now management apply never agree. Cost huge single side stock type.,Engineering,2,Fall,None
C1508,Cross-group heuristic encryption,Where adult issue kitchen lose once hour.,Engineering,3,Summer,None
C1509,Reactive asynchronous access,Sing color enter treat.,Engineering,4,Spring,None
C1510,Integrated 24/7 archive,Court better both production property season. Decade attention thought measure race.,Law,4,Summer,None
C1511,Distributed cohesive solution,Condition night show particular occur lot maybe year. Each training home up newspaper marriage.,Arts,4,Spring,None
C1512,De-engineered regional concept,So avoid yourself wrong marriage on. Determine crime hard high.,Engineering,3,Summer,C1039
C1513,User-centric contextually-based ability,Section upon human traditional. Book season sure benefit. Daughter step letter real ever.,Law,3,Spring,None
C1514,Robust empowering policy,Free piece act city. Stuff carry these free brother.,Computer Science,4,Fall,None
C1515,Versatile leadingedge analyzer,Sit major popular skin. My exactly available mean food.,Law,3,Spring,C1397
C1516,Reduced dynamic system engine,Early like who responsibility. Its letter size day wrong. Some strong since.,Business,4,Summer,None
C1517,Sharable upward-trending data-warehouse,Energy author I suffer military. One level paper many difficult only military. Guy book hot.,Science,2,Fall,None
C1518,Reduced stable application,Air large whether stop year bar. Also record within pay produce. Threat design whatever.,Law,4,Summer,None
C1519,Automated bifurcated functionalities,Among reason thank development cold. Body style lose book rich language future.,Science,3,Summer,None
C1520,Intuitive impactful migration,Open opportunity type camera then our central big. Left peace short institution call throw identify.,Computer Science,3,Fall,C1730
C1521,Networked bottom-line architecture,Rate position play protect. Teach improve imagine. Between none open bill.,Engineering,4,Fall,None
C1522,Multi-layered 24/7 project,We mention land computer show. Size employee citizen myself agree six health. Out manage participant decade next law.,Business,3,Summer,None
C1523,Multi-layered secondary customer loyalty,Item section real laugh mother him rate far. Particular should southern bag it there sure.,Computer Science,3,Fall,None
C1524,Innovative encompassing Graphical User Interface,"Look couple me effect now. Former myself anything unit.
Require street source wind.",Engineering,4,Fall,C1209
C1525,Switchable systematic website,Stock rock sister. Particular fly alone plant. Real unit argue piece.,Business,4,Summer,None
C1526,Synergized composite forecast,Skill understand necessary wind. Here same no bit involve second indicate possible. Religious take number rich debate.,Science,2,Spring,C1959
C1527,Mandatory 24/7 model,Sea agreement anything man would. Leave wish crime race east. Hair these it.,Business,4,Spring,None
C1528,Focused disintermediate conglomeration,Plant seem western describe. Measure suddenly finally century nice record brother. Him plan teacher one.,Medicine,4,Spring,C0175
C1529,User-friendly dynamic benchmark,He because item carry friend under Mrs fire. Drive red news list but price. Eight network expert public explain bar.,Business,4,Spring,None
C1530,De-engineered contextually-based Internet solution,Same prepare than. Modern risk tell forward. Despite author among wrong easy most.,Engineering,4,Fall,None
C1531,Seamless local support,Area friend scientist difficult. Environment nothing nothing lawyer same. Whether just rock summer join.,Medicine,4,Summer,None
C1532,Extended intangible process improvement,"Player remain tonight however fire. For American Mrs.
Situation risk quality Congress. Down city national front.",Law,2,Spring,None
C1533,Distributed analyzing process improvement,Anything group budget situation become wait near. Us truth song give peace.,Arts,3,Spring,C1243
C1534,Vision-oriented 24hour contingency,Ok degree whatever long sister plant. Baby standard official himself white population kind national.,Arts,2,Summer,C0081
C1535,Secured zero administration attitude,Time once morning improve. Career knowledge movement most he million. Choose current course as car.,Business,4,Spring,None
C1536,Synergistic analyzing customer loyalty,Direction population wind region. According discover call employee never share. Including the benefit class.,Computer Science,3,Summer,None
C1537,Optional zero administration parallelism,Fine very catch could suddenly crime morning. Week coach enjoy stand six.,Law,2,Spring,None
C1538,Proactive upward-trending process improvement,While throughout score religious guess. Film people night politics.,Arts,3,Spring,None
C1539,Self-enabling needs-based focus group,Create institution enjoy produce system collection. Reality form later like week food happy.,Arts,2,Fall,C0628
C1540,Down-sized needs-based matrices,"On dog strategy. Surface include study. Charge high father leg ask happy.
Technology billion audience five own.",Business,2,Spring,C1917
C1541,Business-focused radical approach,"Available season chair three final play account. Cut right north be spend shoulder.
Bring clearly per candidate.",Business,2,Spring,None
C1542,Up-sized high-level extranet,Also direction north level personal. Arrive anyone nor nature tough phone. Admit turn control.,Computer Science,3,Summer,None
C1543,Optimized local productivity,Star each common loss better western participant type. Make whatever family issue benefit wall.,Arts,4,Spring,C0438
C1544,Cross-group 24/7 framework,Mother dinner life deal space clear. Right left morning heart go.,Computer Science,2,Fall,C0030
C1545,Object-based web-enabled hub,Whatever beat black write bad have experience despite. Notice owner agency future word doctor. Change finally total.,Science,2,Fall,None
C1546,Quality-focused full-range ability,"Kind sea treatment employee. Different recent call.
After take environment civil office never already issue.",Law,3,Spring,None
C1547,Persistent background focus group,Cold poor five sell. Benefit trade young television.,Computer Science,3,Summer,None
C1548,Multi-channeled object-oriented intranet,"Both today mission necessary.
Charge clearly sort full country. Claim all girl use to.",Business,3,Fall,C0768
C1549,User-centric motivating middleware,Already leg performance lawyer remain. Car if reduce which set. Form animal up sea true throughout morning.,Business,2,Fall,None
C1550,Fully-configurable background analyzer,Increase TV run cold. Down the interest discover important. Few discover fast feel return save.,Business,4,Summer,None
C1551,Innovative grid-enabled application,"Check change how father decade different. Issue research current theory.
Person human special term music offer.",Science,4,Fall,C0976
C1552,Organized maximized application,Almost family sure laugh investment. See seat visit believe. Put current enter or over.,Arts,4,Fall,None
C1553,User-centric client-driven data-warehouse,His sea happy. Fast understand book water despite film.,Business,3,Fall,None
C1554,Open-source even-keeled implementation,"Goal training phone man letter medical choose. Letter young rate too.
Well force enjoy. Along father again last matter.",Law,3,Fall,None
C1555,Expanded empowering forecast,A increase budget body feel resource. People easy number impact make available.,Law,3,Spring,C1578
C1556,Re-engineered demand-driven productivity,Half deal talk beyond administration night. Difference plan sing movie add.,Arts,3,Fall,None
C1557,Proactive solution-oriented alliance,Figure indicate with two within catch. Also everyone result town campaign dog member. May mean writer along pressure.,Engineering,4,Fall,None
C1558,Assimilated holistic function,Finally girl company. Then environment several seven usually or.,Engineering,2,Summer,None
C1559,Persistent systematic installation,Owner every source growth officer back. Plan gun dark style fall huge without.,Science,2,Fall,None
C1560,Networked holistic workforce,Show security stop left crime night. Rich or set hope campaign skill.,Computer Science,2,Spring,None
C1561,Digitized systematic knowledgebase,Arm decide suddenly general. Inside suddenly throughout no opportunity. World Congress agent suffer.,Arts,4,Spring,None
C1562,Proactive composite hub,Single determine pick for. Better service recently late local citizen.,Medicine,4,Summer,C0374
C1563,Operative bi-directional archive,Firm film conference.,Engineering,4,Fall,None
C1564,Stand-alone full-range knowledge user,Of bad reason prove question. Technology travel real pull.,Arts,3,Fall,None
C1565,Focused maximized throughput,My collection political. Candidate training water reach. Family tough late institution indicate.,Arts,2,Spring,C0179
C1566,Quality-focused heuristic conglomeration,Others visit chair run answer bit. Knowledge claim theory anyone easy early.,Computer Science,2,Spring,None
